{
  "$schema": "https://json-schema.org/draft/2020-12/schema",
  "title": "Mythic Video Short Manifest",
  "type": "object",
  "required": ["project_id", "title", "language", "duration_seconds", "characters", "beats"],
  "properties": {
    "project_id": {"type": "string", "minLength": 1},
    "title": {"type": "string", "minLength": 1},
    "language": {"const": "hi-IN"},
    "duration_seconds": {"type": "number", "minimum": 45, "maximum": 1200, "description": "45-120s Short; above 120s is long-form (see src/remotion/format.ts profileFor)."},
    "characters": {"type": "array", "items": {"type": "string"}},
    "beats": {
      "type": "array",
      "minItems": 5,
      "items": {
        "type": "object",
        "required": ["beat_id", "duration_seconds", "visual_role", "asset_refs"],
        "properties": {
          "beat_id": {"type": "string"},
          "duration_seconds": {"type": "number", "exclusiveMinimum": 0},
          "visual_role": {"type": "string"},
          "asset_refs": {"type": "array", "items": {"type": "string"}},
          "new_asset_required": {"type": "boolean"},
          "camera": {"type": "string"},
          "animation": {"type": "string"},
          "text": {"type": "string"}
        }
      }
    }
  }
}
